{"$schema":"../schemas/repository-registry.schema.json","schema_version":"opencoven.repository-registry/v1","organization":"OpenCoven","scope":{"visibility":"public-only","observed_as_of":"2026-09-05","expected_public_repository_count":31,"private_inventory":"federated-and-intentionally-omitted","private_overlay_policy":"policies/public-private-data.md"},"defaults":{"visibility":"public","observed":{"default_branch":"main","archived":false},"owner":"BunsDev","technical_dri":"BunsDev","ownership_status":"bootstrap-single-owner","canonical_domains":[],"does_not_own":[],"disposition":{"state":"retain","review_by":"2026-12-02"},"agent_manifest":{"status":"planned","path":"agent/manifest.json"},"security_support":"limited","observation_status":"verified-public"},"repositories":[{"name":".github","lifecycle":"active","canonicality":"canonical","risk_class":"R4","purpose":"Public organization governance, portfolio coordination, shared policy, and generated public views.","canonical_domains":["organization.governance","organization.portfolio","organization.shared-policy"],"does_not_own":["familiar.identity","protected.authorization","project-orchestration","runtime.persistence","runtime.execution","release.approval","publication.approval","automation.lifecycle"],"agent_manifest":{"status":"enforced","path":"agent/manifest.json"},"security_support":"active"},{"name":"brand","lifecycle":"active","canonicality":"canonical","risk_class":"R2","purpose":"Canonical OpenCoven visual identity, voice, and public-web profile.","canonical_domains":["brand.identity","brand.voice","brand.public-web-profile"],"does_not_own":["product.production-ui"],"security_support":"active"},{"name":"cast-codes","lifecycle":"archived","canonicality":"historical","risk_class":"R1","purpose":"Historical product and release lineage retained with successor context.","observed":{"default_branch":"main","archived":true},"disposition":{"state":"retain-archive","review_by":"2027-09-03"},"agent_manifest":{"status":"exempt","path":"agent/manifest.json"},"security_support":"historical"},{"name":"chat","lifecycle":"active","canonicality":"supporting","risk_class":"R3","purpose":"Production-oriented read-only desktop client for bounded Cave SDK chat access.","does_not_own":["product.production-ui","runtime.persistence","protected.authorization"],"security_support":"active"},{"name":"claude-code-cast","lifecycle":"deprecated","canonicality":"none","risk_class":"R2","purpose":"Legacy coding-event adapter and redaction fixtures.","disposition":{"state":"consolidate-then-retire","review_by":"2026-12-02","destination":{"kind":"repository","name":"coven-code"}},"security_support":"unsupported"},{"name":"coven","lifecycle":"active","canonicality":"canonical","risk_class":"R4","purpose":"Daemon authority, persistence, sessions, runtime execution, authoritative state transitions, and the automation lifecycle: definitions and revisions, schedule planning and occurrences, runs and attempts, automation leases and fences, retries and recovery, events and changefeed, artifacts, and receipts.","canonical_domains":["runtime.daemon-authority","runtime.persistence","runtime.sessions","runtime.execution","automation.definitions","automation.revisions","automation.schedule-planning","automation.occurrences","automation.runs","automation.attempts","automation.leases","automation.fences","automation.retries","automation.recovery","automation.events","automation.changefeed","automation.artifacts","automation.receipts"],"does_not_own":["familiar.identity","protected.authorization","project-orchestration"],"security_support":"active"},{"name":"coven-cave","lifecycle":"active","canonicality":"canonical","risk_class":"R3","purpose":"Primary human oversight product and production UI behavior.","canonical_domains":["product.human-oversight","product.production-ui"],"does_not_own":["runtime.persistence","protected.authorization"],"security_support":"active"},{"name":"coven-code","lifecycle":"active","canonicality":"canonical","risk_class":"R3","purpose":"Terminal coding execution and headless coding contracts.","canonical_domains":["execution.terminal-coding"],"does_not_own":["project-orchestration","runtime.persistence"],"security_support":"active"},{"name":"coven-codeflow","lifecycle":"deprecated","canonicality":"none","risk_class":"R3","purpose":"Overlapping coding cockpit and execution experiment.","observed":{"default_branch":"master","archived":false},"disposition":{"state":"consolidate-then-retire","review_by":"2026-12-02","destination":{"kind":"repository","name":"coven-code"}},"security_support":"unsupported"},{"name":"coven-design-system","lifecycle":"deprecated","canonicality":"none","risk_class":"R2","purpose":"Overlapping design-system experiment whose useful work should be extracted without retaining a canonical claim.","disposition":{"state":"consolidate-then-retire","review_by":"2026-12-02","destination":{"kind":"portfolio","names":["brand","ui","coven-cave"]}},"security_support":"unsupported"},{"name":"coven-docs","lifecycle":"active","canonicality":"canonical","risk_class":"R1","purpose":"Public documentation and generated compatibility presentation.","canonical_domains":["knowledge.public-documentation","knowledge.compatibility-presentation"],"does_not_own":["protocol.normative-artifacts"],"security_support":"active"},{"name":"coven-github-webhook","lifecycle":"deprecated","canonicality":"none","risk_class":"R3","purpose":"Noncanonical GitHub delivery bundle pending consolidation into the private delivery overlay.","disposition":{"state":"consolidate-then-retire","review_by":"2026-12-02","destination":{"kind":"private-overlay","id":"github-delivery"}}},{"name":"coven-landing","lifecycle":"active","canonicality":"supporting","risk_class":"R1","purpose":"Public marketing and product landing surface.","does_not_own":["brand.public-web-profile","knowledge.public-documentation"],"security_support":"active"},{"name":"coven-memory","lifecycle":"active","canonicality":"canonical","risk_class":"R3","purpose":"Read-only memory client and projection; never a second memory authority.","canonical_domains":["memory.read-only-client","memory.projection"],"does_not_own":["memory.authoritative-state","runtime.persistence"],"security_support":"active"},{"name":"coven-pocket","lifecycle":"maintenance","canonicality":"none","risk_class":"R3","purpose":"Mobile experiment pending a distinct boundary or consolidation into Cave mobile.","disposition":{"state":"evaluate-consolidation-or-private-incubation","review_by":"2026-12-02","destination":{"kind":"repository","name":"coven-cave"}}},{"name":"coven-reach","lifecycle":"maintenance","canonicality":"none","risk_class":"R3","purpose":"Filesystem/network capability experiment pending redesign around explicit leases and authorization.","disposition":{"state":"private-incubation-or-retire","review_by":"2026-12-02","destination":{"kind":"private-overlay","id":"leased-capability-execution"}}},{"name":"coven-runtimes","lifecycle":"active","canonicality":"canonical","risk_class":"R4","purpose":"Runtime capability descriptors, registry, and conformance.","canonical_domains":["runtime.capability-descriptors","runtime.conformance"],"does_not_own":["runtime.execution","runtime.persistence"],"security_support":"active"},{"name":"coven-scout","lifecycle":"maintenance","canonicality":"none","risk_class":"R3","purpose":"Overlapping filesystem/web capability experiment pending selection of one hardened successor.","disposition":{"state":"private-incubation-or-retire","review_by":"2026-12-02","destination":{"kind":"private-overlay","id":"leased-capability-execution"}}},{"name":"coven-threads","lifecycle":"active","canonicality":"canonical","risk_class":"R4","purpose":"Protected-surface authorization and proposal-versus-commit decisions.","canonical_domains":["authority.protected-surface","authority.proposal-commit-decisions"],"does_not_own":["runtime.persistence","project-orchestration"],"security_support":"active"},{"name":"demo-workspace","lifecycle":"incubating","canonicality":"supporting","risk_class":"R1","purpose":"Minimal public demonstration and deterministic fixture workspace.","disposition":{"state":"graduate-or-retire","review_by":"2026-12-02"},"security_support":"unsupported"},{"name":"desktop-use","lifecycle":"maintenance","canonicality":"none","risk_class":"R3","purpose":"Desktop capability experiment pending product-boundary review.","disposition":{"state":"evaluate-consolidation-or-private-incubation","review_by":"2026-12-02","destination":{"kind":"repository","name":"coven-cave"}}},{"name":"familiar-contract","lifecycle":"active","canonicality":"canonical","risk_class":"R4","purpose":"Governed portable familiar identity, principal binding, and revision semantics.","canonical_domains":["identity.familiar-contract","identity.principal-binding","identity.revision-semantics"],"does_not_own":["project-orchestration","runtime.persistence"],"security_support":"active"},{"name":"homebrew-tap","lifecycle":"active","canonicality":"supporting","risk_class":"R4","purpose":"Canonical Homebrew distribution channel for released OpenCoven artifacts.","does_not_own":["release.approval","artifact.provenance-source"],"security_support":"active"},{"name":"open-fable","lifecycle":"incubating","canonicality":"none","risk_class":"R2","purpose":"Speculative research experiment without an approved public canonical boundary.","disposition":{"state":"private-incubation-or-retire","review_by":"2026-12-02","destination":{"kind":"private-overlay","id":"research-incubation"}},"security_support":"unsupported"},{"name":"open-meow-sdk","lifecycle":"archived","canonicality":"historical","risk_class":"R1","purpose":"Archived predecessor SDK retained for provenance.","observed":{"default_branch":"main","archived":true},"disposition":{"state":"retain-archive","review_by":"2027-09-03","destination":{"kind":"repository","name":"sdk"}},"agent_manifest":{"status":"exempt","path":"agen